{
  "schema_version": 1,
  "id": "skill",
  "summary": "Agent Skill core with SKILL.md and structural validation; application capabilities and contract/release lifecycle components are explicit opt-ins.",
  "artifact": "artifact.skill-core",
  "required_components": [],
  "default_components": [],
  "optional_components": [
    "capability.cli",
    "capability.mcp",
    "capability.mcp-apps",
    "capability.runtime",
    "capability.service",
    "capability.web-interface",
    "lifecycle.contract-evolution",
    "lifecycle.implementation-evidence",
    "lifecycle.release-bundle",
    "lifecycle.release-evidence",
    "lifecycle.release-execution",
    "topology.hub-and-orphan",
    "workspace.bare-worktree"
  ]
}
