{
  "schema_version": 1,
  "id": "website",
  "summary": "Framework-neutral content-oriented Website with shared Web routes, page structure, document metadata, discovery semantics, and implementation evidence; PWA, WebMCP, runtime, service, Web interface, and release are explicit opt-ins.",
  "artifact": "artifact.website-core",
  "required_components": [],
  "default_components": [],
  "optional_components": [
    "capability.pwa",
    "capability.runtime",
    "capability.service",
    "capability.web-interface",
    "capability.webmcp",
    "lifecycle.release-bundle",
    "topology.hub-and-orphan",
    "workspace.bare-worktree"
  ]
}
