{
  "schema_version": 1,
  "id": "webapp",
  "summary": "Framework-neutral Web application core with routes, surfaces, UI states, viewports, contract evolution, and implementation evidence; release and application capabilities including WebMCP are explicit opt-ins.",
  "artifact": "artifact.webapp-core",
  "required_components": [],
  "default_components": [],
  "optional_components": [
    "capability.cli",
    "capability.mcp",
    "capability.mcp-apps",
    "capability.pwa",
    "capability.runtime",
    "capability.service",
    "capability.web-interface",
    "capability.webmcp",
    "lifecycle.release-bundle",
    "topology.hub-and-orphan",
    "workspace.bare-worktree"
  ]
}
